{
    "port":"8745",
    "serverName":"KadiskEcosystemMonitoringWebService",
    "ecosystemDefaultsFileRelativePath":"./config-files/ecosystem-defaults.json",
    "instanceMonitoringManagerServiceStorageFilePath": "/workspaces/databases/instance-monitoring-manager-service.sqlite",
    "installDataDirPath":"~/EcosystemData"
}

